@id,name,amenity,`addr:street`,addr:city,`@lat`,`@lon`
5361001722,Pharmacie Assafwa صيدلية الصفوة,pharmacy,N 24 LOT LAALEJ BENSOUDA,Fès,34.0215063,-5.0490094
5361214423,Pharmacie El Hijazi صيدلية الحجازي,pharmacy,17 Lotiss Hatim Bensoudza,Fès,34.0202864,-5.0462911
5370125323,Pharmacie Sandra صيدلية ساندرا,pharmacy,Lot Mssafer Bensouda,Fès,34.0242119,-5.0506962
5370323321,Pharmacie Zouagha Bas صيدلية الزواغة السفلى,pharmacy,Lot Moulay Driss hay el marja,Fès,34.0277814,-5.0462297
5372625428,Pharmacie Al Hamd صيدلية الحمد,pharmacy,HAY LMARJA RTE ZOUAGHA FES,Fès,34.0274386,-5.0413497
5375123532,Pharmacie El Qods صيدلية القدس,pharmacy,,Fès,34.0156066,-5.0510426
5375153021,Pharmacie L'Avenir صيدلية المستقبل,pharmacy,122 LOTTI TAOUFIK AL MARJAT,Fès,34.0303541,-5.0410357
5377810721,Pharmacie Al Marja صيدلية المرجة,pharmacy,Rue 27 Marja,Fès,34.0312285,-5.0446229
5377973123,Pharmacie Attaakhi صيدلية التآخي,pharmacy,Lot Star Sakane marja,Fès,34.031626,-5.051411
5392797622,Pharmacie Arreda صيدلية الرضا,pharmacy,ZOUAGHA RTE BENSOUDA,Fès,34.0365448,-5.0494287
5393784822,Pharmacie Sefrioui صيدلية الصفريوي,pharmacy,Route d ' Ain Chkef,Fès,34.0088152,-5.0097849
5393785323,Pharmacie Diamant Vert صيدلية الجوهرة الخضراء,pharmacy,Route d ' Ain Chkef Lotis Karaouiyine,Fès,34.0009245,-5.0120511
5395575621,Pharmacie Ouad El Jawahir صيدلية واد الجواهر,pharmacy,4 RUE 15 BLOC D HAY OUED FEZ MARJA,Fès,34.0388197,-5.0507853
5398354121,Pharmacie Wafi صيدلية الوافي,pharmacy,Riad Zouhour Marja Ouad,Fès,34.036935,-5.0441143
5398499522,Pharmacie Espace Santé صيدلية فضاء الصحة,pharmacy,235 LOTTI EZZOHOR HAY EL MARJA,Fès,34.0341382,-5.0436688
5398558823,Pharmacie Haj Bensalem صيدلية الحاج بنسالم,pharmacy,Hay Mikou Marja Ouad,Fès,34.0351489,-5.038962
5398624423,Pharmacie Italia صيدلية إيطاليا,pharmacy,Hay Tazi Marja Ouad,Fès,34.0401158,-5.0349723
5400932621,Pharmacie Al Najoua صيدلية النجوى,pharmacy,1 RUE 9 HAY MIKOU MERJA FEZ,Fès,34.0375903,-5.0406043
5407132238,Pharmacie El Iraki صيدلية العراقي,pharmacy,,Fès,34.0147038,-5.0486606
5407220722,Pharmacie Al Oumma صيدلية الأمة,pharmacy,61B ROUTE BENSOUDA ZOUAGHA,Fès,34.0233281,-5.0375648
5414211822,Pharmacie Zouagha صيدلية الزواغة,pharmacy,ZOUAGHAT RTE BENSOUDA,Fès,34.0247648,-5.0351104
5424399125,Pharmacie Bensouda صيدلية بن سودة,pharmacy,3 hay Msallah fes,Fès,34.0170139,-5.0531777
5424447822,Pharmacie Av Med VI صيدلية شارع محمد السادس,pharmacy,BVD MOHAMMED 6 ZOUAGHAT,Fès,34.0263639,-5.028244
5430059334,Pharmacie des Sciences صيدلية العلوم,pharmacy,347 LOT QUARAOUIYINE RTE AIN CHEKAF,Fès,34.0104753,-5.0176469
5437048725,Pharmacie Sekkat صيدلية السقاط,pharmacy,hay nakhil rte bain smen,Fès,34.0125631,-5.0227221
5437151022,Pharmacie Al Wahda صيدلية الوحدة,pharmacy,bd Abou houraira mont fleuri 1 FES,Fès,34.0132168,-5.0514716
5439966421,Pharmacie Kandoussi صيدلية القندوسي,pharmacy,132 Lotiss farah bensouda fes,Fès,34.0037878,-5.0446424
5445400122,Pharmacie Ain Smen صيدلية عين السمن,pharmacy,HAY AL WEFAK BLOC N 172 FEZ,Fès,34.0120186,-5.0262209
5446674221,Pharmacie Errachidia صيدلية الراشدية,pharmacy,LOT ARRACHIDIA RTE AIN CHEKEF,Fès,34.015282,-5.0136845
5472824321,Pharmacie Al Wissal صيدلية الوصال,pharmacy,PROJET WIAM RESIDENCE ZAHRAE HAY NASSIM FES,Fès ⴼⴰⵙ فاس,33.9952412,-5.0560575
5472942725,Pharmacie Al Kaoutar صيدلية الكوثر,pharmacy,210 BLOC A HAY WIFAK RTE AIN SMEN,Fès,34.0136031,-5.0293645
5490795223,Pharmacie Fahmi صيدلية فهمي,pharmacy,Hay Griyou Zouagha Haute,Fès,34.0170581,-5.0296466
5490862523,Pharmacie Ayoub صيدلية أيوب سيد الهادي,pharmacy,Hay Griyou Zouagha Haute,Fès,34.0153361,-5.031363
5495984921,Pharmacie Basma,pharmacy,Hay Jadid Zouagha Haute,,34.0173431,-5.0331285
5496103023,Pharmacie Annamae صيدلية النماء,pharmacy,,Fès,33.9986675,-5.0577644
5496517321,Pharmacie la Ferraille صيدلية لافيراي,pharmacy,,Fès,33.999834,-5.0540763
5505183922,Pharmacie le Coin صيدلية الركن,pharmacy,Hay Jdid Zouagha Haute,Fès,34.012893,-5.0331652
5507936522,Pharmacie Sanabil صيدلية السنابل,pharmacy,BVD Sanabil Zouagha Haute,Fès,34.021261,-5.03528
5522399521,Pharmacie Dar Es-Salam صيدلية دار السلام,pharmacy,Lot Mhamdia Zouagha Haute,Fès,34.0232632,-5.0287799
5524915624,Pharmacie Addoha صيدلية الضحى,pharmacy,Bloc B Zouagha Haute,Fès فاس,34.0237733,-5.0322943
5525093277,Pharmacie Oum El Koura صيدلية أم القرى,pharmacy,Hay Jdid Zouagha Haute,Fès,34.0184753,-5.0364946
5527473421,Pharmacie Al Farouk صيدلية الفاروق,pharmacy,Hay Sidi Lhadi Zouagha Haute,Fès,34.0203423,-5.0385293
5527619921,Pharmacie Sidi El Hadi صيدلية سيدي الهادي,pharmacy,Hay Sidi El Hadi,Fès,34.0183742,-5.0407606
5527682122,Pharmacie Al Khattabi صيدلية الخطابي,pharmacy,Lot Adouha Zouagha Haute,Fès,34.0139363,-5.0434335
5528634825,Pharmacie des Roches صيدلية الصخور,pharmacy,,Fès,33.9948567,-5.0078415
5552817821,Pharmacie Sagha صيدلية الصاغة,pharmacy,,Fès,34.066239,-4.9748059
5558873045,Cabinet Cardiologue,clinic,,,34.0356801,-5.0007628
5558891231,Cabinet de Rheumatologie,hospital,,rue mohamed ZARKTOUNI FEZ,34.0369853,-5.0019344
5718733521,Pharmacie Chifae Arrahmane صيدلية شفاء الرحمان,pharmacy,,Fès,34.0516802,-5.0433317
5727962822,Pharmacie Jardin de Tghath صيدلية حديقة تغاث,pharmacy,Avenue Moussa Ben Noussair,Fès,34.0595306,-5.0238346
5735067971,Pharmacie Errachid صيدلية الرشيد,pharmacy,,Fès ⴼⴰⵙ فاس,34.0704938,-4.9996766
5735223007,Pharmacie Al Imam Mouslim صيدلية الإمام مسلم,pharmacy,,Fès ⴼⴰⵙ فاس,34.0670337,-5.0108801
5740981221,Pharmacie Dar Dmana صيدلية دار الضمانة,pharmacy,Bab Khoukha,Fès ⴼⴰⵙ فاس,34.0650353,-4.9574981
5744062346,Pharmacie Al Youmne صيدلية اليمن,pharmacy,,Fès,34.0092557,-5.0413397
5749776079,Pharmacie Volubilis صيدلية وليلي,pharmacy,Rue Abi Tayeb Al Motanabbi,Fès,34.0347847,-5.0003661
5763509517,clinique nour,clinic,,6 rue kasem amine,34.0306715,-5.0093894
5765530617,clinique haj abdehadi,clinic,,ain kadous fez,34.0617107,-5.0131736
7725405985,Pharmacie Riad Chafi صيدلية رياض الشافي,pharmacy,Avenue Naoual,Fès,34.0164626,-4.9599062
8972515927,Pharmacie Asmae صيدلية أسماء,pharmacy,Avenue Rachad,Fès,34.0136448,-4.9752165
8972595649,Pharmacie du Lido صيدلية الليدو,pharmacy,Route des Champs شارع الجولان,Fès,34.0331265,-4.9904057
8984249652,Pharmacie Saada صيدلية السعادة,pharmacy,HAY SAADA RTE AIN CHQEF,Fès,34.0256245,-5.0048828
8993802951,Pharmacie Gharnata صيدلية غرناطة,pharmacy,,Fès,34.0357569,-5.0287686
9010895004,Pharmacie Berrada صيدلية برادة,pharmacy,,Fès,34.0591521,-5.0138627
9010900716,Pharmacie Averroès صيدلية ابن رشد,pharmacy,Ibn Hajar,Fès,34.0433492,-5.0091946
9032660795,Pharmacie Attouraya صيدلية الثريا,pharmacy,,Fès ⴼⴰⵙ فاس,34.0695594,-4.9955712
9032668703,Pharmacie Hay Belkhayat صيدلية حي بلخياط,pharmacy,,Fès,34.0686025,-5.001806
9032672710,Pharmacie Al Mamalik صيدلية الممالك,pharmacy,,Fès,34.0658698,-4.9968004
9032747370,Pharmacie le Remède صيدلية الدواء,pharmacy,,Fès ⴼⴰⵙ فاس,34.0588845,-5.0111457
9032748170,Pharmacie Ain Kadouss صيدلية عين قادوس,pharmacy,,Fès,34.0598898,-5.008256
9032830871,Pharmacie Benkirane صيدلية بنكيران,pharmacy,,Fès,34.0596226,-5.0169477
9032834575,Pharmacie El Ghazi صيدلية الغازي,pharmacy,,Fès,34.0567516,-5.0152941
9035353158,Pharmacie Jbel Tghat صيدلية جبل ثغات,pharmacy,,Fès,34.0577633,-5.0212595
9035364493,Pharmacie Faiza صيدلية فايزة,pharmacy,,Fès فاس,34.0566911,-5.0303904
9035500323,Pharmacie Salah صيدلية صلاح,pharmacy,,Fès,34.0554449,-5.0256744
9035505122,Pharmacie Reda صيدلية رضا,pharmacy,,Fès,34.0571553,-5.0267418
9035534360,Pharmacie Al Imane صيدلية الإيمان,pharmacy,,Fès,34.0523514,-5.0344778
9035544128,Pharmacie Al Falah صيدلية الفلاح,pharmacy,,Fès فاس,34.0550044,-5.0287002
9035591817,Pharmacie Ain Haroun صيدلية عين هارون,pharmacy,,Fès,34.066531,-5.0073181
9035612159,Pharmacie Ibn Al Khatib صيدلية بن الخطيب,pharmacy,,Fès,34.0665259,-5.0035026
9035630210,Pharmacie Agadir صيدلية أكادير,pharmacy,,Fès,34.063744,-5.009789
9035717748,Pharmacie Saida صيدلية سعيدة,pharmacy,,Fès,34.0651564,-5.0162463
9035797630,Pharmacie Es-Salam صيدلية السلام,pharmacy,Avenue Oqba Ben Nafia,Fès,34.0610614,-5.0123122
9038248382,Pharmacie Ibn Sina صيدلية ابن سينا,pharmacy,,Fès,34.0634415,-5.0054342
9038251500,Pharmacie Dayaa صيدلية الضيعة,pharmacy,,Fès,34.0627967,-5.0181666
9038273758,Pharmacie Hay Laalou صيدلية حي لعلو,pharmacy,,Fès,34.0651138,-5.0121204
9038321797,Pharmacie Al Imam Malik صيدلية الإمام مالك,pharmacy,,Fès,34.0622255,-5.0215687
9038337026,Pharmacie Al Marwa صيدلية المروى,pharmacy,,Fès,34.0602017,-5.0285858
9040946630,Pharmacie Al Hilal صيدلية الهلال,pharmacy,,Fès ⴼⴰⵙ فاس,34.0611772,-5.0330511
9041087322,Pharmacie Soundous صيدلية السندس,pharmacy,,Fès,34.0593037,-5.0364883
9041103033,Pharmacie El Boukhari صيدلية البخاري,pharmacy,,Fès,34.0567425,-5.0352601
9041125608,Pharmacie Mounia صيدلية مونية,pharmacy,,Fès ⴼⴰⵙ فاس,34.058589,-5.0397344
9041137082,Pharmacie Youssef Ben Tachafine صيدلية يوسف تاشفين,pharmacy,,Fès,34.0549853,-5.0415456
9041162334,Pharmacie Lhoumadi صيدلية لحومادي,pharmacy,,Fès,34.0511596,-5.0393854
9041164672,Pharmacie Maalal صيدلية معلال,pharmacy,,Fès ⴼⴰⵙ فاس,34.0531852,-5.0380269
9041205020,Pharmacie Hasnaoui صيدلية الحسناوي,pharmacy,,Fès ⴼⴰⵙ فاس,34.0587131,-5.0454574
9041206899,Pharmacie Dr Obtel صيدلية د.أوبتيل,pharmacy,,Fès ⴼⴰⵙ فاس,34.05283,-5.048599
9041211850,Pharmacie El Mountazah صيدلية المنتزه,pharmacy,,Fès,34.0558711,-5.0446871
9041249677,Pharmacie Nasma صيدلية نسمة,pharmacy,,Fès ⴼⴰⵙ فاس,34.0453606,-4.9541227
9041266437,Pharmacie Al Hanae صيدلية الهناء,pharmacy,,Fès,34.0488103,-4.9606574
9041318009,Pharmacie Bled Tahiriyine صيدلية بلاد الطاهريين,pharmacy,,Fès,34.0474135,-4.9562404
9041369092,Pharmacie Al Makkiya صيدلية المكية,pharmacy,,Fès,34.0507379,-4.9572886
9043787624,Pharmacie Driss صيدلية إدريس,pharmacy,,Fès,34.0501087,-4.9644643
9043830738,Pharmacie Wisslane صيدلية ويسلان,pharmacy,,Fès,34.0581225,-4.9520117
9043830995,Pharmacie El Louizatt صيدلية اللويزات,pharmacy,,Fès,34.0593227,-4.9564327
9043883647,Pharmacie M'sella صيدلية المصلى,pharmacy,,Fès,34.0524925,-4.9608524
9043883650,Pharmacie la Ménara صيدلية المنارة,pharmacy,,Fès,34.0142987,-4.9681185
9043888667,Pharmacie Kamal صيدلية كمال,pharmacy,,Fès,34.0571051,-4.9544992
9043894386,Pharmacie Al Walidin صيدلية الوالدين,pharmacy,,Fès ⴼⴰⵙ فاس,34.0611174,-4.93784
9043936390,Pharmacie Saguia Lhamra صيدلية الساقية الحمراء,pharmacy,,Fès,34.0182531,-4.9723992
9043956382,Pharmacie Aouinat El Hajjaj صيدلية عوينات الحجاج,pharmacy,,Fès ⴼⴰⵙ فاس,34.0200745,-4.967283
9043968723,Pharmacie El Alj صيدلية العلج,pharmacy,,Fès ⴼⴰⵙ فاس,34.0199568,-4.9679916
9043970857,Pharmacie Alae Arrahman صيدلية الرحمان,pharmacy,,Fès ⴼⴰⵙ فاس,34.0178391,-4.9630909
9044125530,Pharmacie Moulay Abdellah صيدلية مولاي عبد الله,pharmacy,Avenue Derb Moulay Abdellah,Fès ⴼⴰⵙ فاس,34.0571831,-4.9933334
9045350223,Pharmacie Bab Fès صيدلية باب فاس,pharmacy,,Fès ⴼⴰⵙ فاس,34.0611947,-4.9418139
9045364285,Pharmacie Moulay M'Barek صيدلية مولاي مبارك,pharmacy,,Fès,34.0639385,-4.9543363
9045374425,Pharmacie Ain Nokbi صيدلية عين النقبي,pharmacy,,Fès,34.0617846,-4.9526825
9045400740,Pharmacie El Kobba صيدلية القبة,pharmacy,,Fès,34.0644193,-4.9527481
9045416087,Pharmacie Jnane Kadiri صيدلية جنان القادري,pharmacy,,Fès ⴼⴰⵙ فاس,34.067096,-4.955399
9045445097,Pharmacie Al Andalous صيدلية الأندلس,pharmacy,Boulevard des Merinides,Fès ⴼⴰⵙ فاس,34.0704308,-4.966285
9045451994,Pharmacie Jnan Mekouar صيدلية جنان مكوار,pharmacy,,Fès ⴼⴰⵙ فاس,34.0718486,-4.96295
9048910905,Pharmacie Fatima Al Fihriya صيدلية فاطمة الفهرية,pharmacy,,Fès,34.0560754,-4.9741905
9048942320,Pharmacie Zkak Lahjar صيدلية زقاق الحجر,pharmacy,,Fès,34.0633697,-4.9777072
9049003728,Pharmacie Bab El Guissa صيدلية باب عجيسة,pharmacy,,Fès,34.068623,-4.9757032
9049003729,Pharmacie Oued Zhoun صيدلية واد الزحون,pharmacy,,Fès ⴼⴰⵙ فاس,34.0685381,-4.9706313
9051315874,Pharmacie Zarouk صيدلية زروق,pharmacy,,Fès ⴼⴰⵙ فاس,34.0707225,-4.9689367
9051360164,Pharmacie Hanane صيدلية حنان,pharmacy,,Fès ⴼⴰⵙ فاس,34.0667619,-4.9635254
9051362482,Pharmacie Jnan Drader صيدلية جنان الدرادر,pharmacy,,Fès ⴼⴰⵙ فاس,34.0673755,-4.9698138
9051373294,Pharmacie Sidi Boujida صيدلية سيدي بوجيدة,pharmacy,,Fès ⴼⴰⵙ فاس,34.0667762,-4.9669479
9051405111,Pharmacie Ibn Battouta صيدلية بن بطوطة,pharmacy,,Fès ⴼⴰⵙ فاس,34.0656218,-4.9624823
9051555679,Pharmacie Al Anouar صيدلية الأنوار,pharmacy,,Fès ⴼⴰⵙ فاس,34.0637703,-4.9664302
9051567252,Pharmacie Bab El Hamraa صيدلية باب الحمراء,pharmacy,,Fès,34.0605946,-4.9688505
9051585120,Pharmacie Lagzira صيدلية الجزيرة,pharmacy,,Fès,34.0620445,-4.9716214
9056633676,Pharmacie Tadlaoui صيدلية التدلاوي,pharmacy,,Fès,34.0541841,-5.0183917
9060425474,Pharmacie Bouramana صيدلية بورمانة,pharmacy,Rue Khalid Ibn Walid,Fès,34.0225701,-4.9940671
9060655331,Pharmacie de Paris صيدلية باريس,pharmacy,,Fès,34.0103805,-4.9858207
9060727343,Pharmacie Ibn Taymiya صيدلية بن تيمية,pharmacy,Rocade Sud,Fès ⴼⴰⵙ فاس,33.9902509,-4.9908913
9060749381,Pharmacie Slaoui صيدلية السلاوي,pharmacy,,Fès,33.9979001,-4.9846357
9062914094,Pharmacie Meliani صيدلية ملياني,pharmacy,,Fès ⴼⴰⵙ فاس,33.9871216,-4.986228
9062937355,Pharmacie Mouldwa صيدلية مولدوا,pharmacy,Lots Sabaté 1 Zouhour,Fès ⴼⴰⵙ فاس,33.9841552,-4.9860443
9062945305,Pharmacie El Kadiri صيدلية القادري,pharmacy,,Fès ⴼⴰⵙ فاس,33.9921687,-4.9878437
9062947497,Pharmacie Arrayhane صيدلية الريحان,pharmacy,,Fès,33.9945831,-4.970386
9062954266,Pharmacie Almaz صيدلية ألماز,pharmacy,,Fès ⴼⴰⵙ فاس,33.9905847,-4.977379
9062969840,Pharmacie l'Humanité صيدلية الإنسانية,pharmacy,,Fès,33.9782135,-5.0264176
9062971624,Pharmacie Faculté Echariaa صيدلية كلية الشريعة,pharmacy,,Fès,33.9984657,-4.9750457
9062980670,Pharmacie Jardins El Badie صيدلية حدائق البديع,pharmacy,,Fès ⴼⴰⵙ فاس,33.9861055,-5.0122274
9063042255,Pharmacie Diamant de Fès صيدلية جوهرة فاس,pharmacy,,Fès ⴼⴰⵙ فاس,33.9943582,-4.9666565
9063046705,Pharmacie Route Sidi Hrazem صيدلية طريق سيدي حرازم,pharmacy,,Fès ⴼⴰⵙ فاس,34.010757,-4.9558975
9063050284,Pharmacie Menzeh Saïss صيدلية منزه سايس,pharmacy,,Fès ⴼⴰⵙ فاس,34.0075084,-4.9541278
9064150951,Pharmacie Guard صيدلية كارد,pharmacy,,Fès ⴼⴰⵙ فاس,34.0112352,-4.9739285
9064151371,Pharmacie Ibno Tachefine صيدلية ابن تاشفين,pharmacy,Rue Taiwan,Fès ⴼⴰⵙ فاس,34.0117766,-4.9722125
9064248041,Pharmacie Essania صيدلية السانية,pharmacy,,Fès فاس,34.0098741,-4.9609846
9064274028,Pharmacie Bel Air صيدلية بلير,pharmacy,,Fès ⴼⴰⵙ فاس,34.0126429,-4.9607711
9067076233,Pharmacie Ryad Saiss صيدلية رياض سايس,pharmacy,,Fès ⴼⴰⵙ فاس,34.0145582,-4.9616357
9067097844,Pharmacie Hay Riyad صيدلية حي الرياض,pharmacy,,Fès ⴼⴰⵙ فاس,34.0192846,-4.9605092
9067122685,Pharmacie El Otmani صيدلية العثماني,pharmacy,,Fès ⴼⴰⵙ فاس,34.0229583,-4.9649338
9067461578,Pharmacie de l'Université صيدلية الجامعة,pharmacy,Avenue Ibn Khatib زنقة شفشاون,Fès,34.033483,-4.9859151
9074295920,Pharmacie Al Alia صيدلية العالية,pharmacy,Boulevard Abu Houriya,Fès,34.0139018,-5.0059757
9077198847,Pharmacie Masjid Arreda صيدلية مسجد الرضى,pharmacy,,Fès,34.002482,-4.9982576
9077218586,Pharmacie des 3 Sources صيدلية المنابع الثلاث,pharmacy,,Fès,33.9967109,-4.9940193
9077240390,Pharmacie Jamai صيدلية الجامعي,pharmacy,,Fès,33.9952552,-5.003872
9077291355,Pharmacie Rachidia 3 صيدلية الراشدية,pharmacy,,Fès,34.0123275,-5.0141604
9077313479,Pharmacie Al Alaoui صيدلية العلوي,pharmacy,,Fès ⴼⴰⵙ فاس,33.9918236,-5.0052984
9077395032,Pharmacie Riad El Yassamine صيدلية رياض الياسمين,pharmacy,,Fès,33.9947174,-5.0112751
9080092417,Pharmacie Steven صيدلية ستيفن,pharmacy,,فاس,34.0258203,-5.0095409
9080252241,Pharmacie Technologie صيدلية التكنولوجيا,pharmacy,,Fès,34.0077585,-5.0138875
9080367514,Pharmacie Socrate صيدلية سقراط,pharmacy,,Fès,34.0039944,-5.0171304
9080513814,Pharmacie Zahraoui صيدلية الزهراوي,pharmacy,,Fès,34.001512,-5.0153503
9082210309,Pharmacie Al Madina صيدلية المدينة,pharmacy,,Fès,34.0032877,-5.0111208
9082226035,Pharmacie Borj Ennakhil صيدلية برج النخيل,pharmacy,,Fès,33.99852,-5.0160907
9082234019,Pharmacie Zineb صيدلية زينب,pharmacy,,Fès,33.9948475,-5.0175189
9082250910,Pharmacie Ahel Fès صيدلية أهل فاس,pharmacy,,Fès ⴼⴰⵙ فاس,33.9877828,-5.0407775
9082252419,Pharmacie California صيدلية كاليفورنيا,pharmacy,,Fès ⴼⴰⵙ فاس,33.9925945,-5.0205935
9082305309,Pharmacie El Aziza صيدلية العزيزة,pharmacy,,Fès ⴼⴰⵙ فاس,33.9938707,-5.0313473
9088108976,Pharmacie Rihab صيدلية رحاب,pharmacy,,Fès,34.0360636,-5.0051466
9088262543,Pharmacie Bennouna صيدلية بنونة,pharmacy,,Fès,34.0233152,-5.0237243
9088494169,Pharmacie Aida صيدلية عايدة,pharmacy,,Fès,34.0390484,-5.0183225
9091590534,Pharmacie Zahir صيدلية زاهر,pharmacy,,Fès ⴼⴰⵙ فاس,34.021658,-5.0579744
9091796679,Pharmacie Dalia صيدلية الدالية,pharmacy,,Fès ⴼⴰⵙ فاس,33.9932207,-5.0520318
9094719849,Pharmacie Wisslane صيدلية ويسلان,pharmacy,,Fès,34.0168098,-5.0494146
9094725558,Pharmacie des Champs صيدلية الحقول,pharmacy,,Fès,34.0361253,-5.0345556
9094730495,Pharmacie Moussaoui صيدلية موساوي,pharmacy,,Fès,34.0414705,-5.048577
9094860849,Pharmacie Al Omnia صيدلية الأمنية,pharmacy,,Fès,34.0272369,-5.0520034
9094866098,Pharmacie Paraconfiance صيدلية باراكونفيونس,pharmacy,,Fès,34.0226454,-5.0489759
9098553534,Pharmacie Nellia صيدلية نيليا,pharmacy,,Fès,34.0144488,-5.0362829
9098697829,Pharmacie Belmhani صيدلية بلمهاني,pharmacy,,Fès ⴼⴰⵙ فاس,34.0523606,-4.9924017
9105637082,Pharmacie Tajmouati صيدلية تجموعتي,pharmacy,,Fès,34.0117048,-5.0070681
9105659218,Pharmacie El Borj صيدلية البرج,pharmacy,,Fés,34.0686958,-4.9857424
9105667807,Pharmacie Hay Benslimane صيدلية حي بنسليمان,pharmacy,,Fès,34.0696287,-4.9864241
9105714468,Pharmacie de Fès صيدلية فاس,pharmacy,,Fès,34.06438,-5.0110997
9107961171,Pharmacie Ouandou صيدلية واندو,pharmacy,Avenue Youssef Ben Tachefine,Fès فاس,34.0572905,-5.0314442
9107998723,Pharmacie Ziat صيدلية الزيات,pharmacy,,Fès,34.0585728,-4.9791927
9651845874,Pharmacie Nationale,pharmacy,,,34.0626035,-4.9795049
11078278907,مصحة طب العيون فاس OCF,clinic,,,34.0280753,-4.998582
11309227132,Pharmacie Nour,pharmacy,,,34.0529333,-4.9921724
11383498778,,clinic,,,34.0038095,-4.9726886
13265043539,Pharmacie ROUTE AIN CHKEF,pharmacy,lot Riad yassamine,Fes,33.9976267,-5.011974
150786744,University hospital Hassan II,hospital,,,34.0043481,-4.9622857
394139696,Clinique RAIS,hospital,Avenue Allal Ben Abdallah,Fès,34.0335173,-5.006211
394139704,Clinique Agdal مصحة أكدال,clinic,,Fès,34.0356144,-5.0091297
478962749,clinique Nour مصحة النور,clinic,,FEZ,34.0306759,-5.0094088
530892959,Croissant rouge marocain,hospital,,rue mohamed el hansali fes,34.0382154,-5.0006078
531716167,Dispensaire,clinic,Avenue Lalla Hasnae,Fes ville,34.0448754,-5.0012175
533829327,Hôpital Omar Drissi,hospital,"Av Allal El Fassi Avenue de La Liberte, Fès, Maroc",,34.0573836,-4.9813786
561184067,مستشفى ابن البتطار,hospital,,فاس,34.0425666,-4.9847657
606741265,Polyclinique Atlas,clinic,Boulevard Moulay Rachid,Fez,34.0264562,-4.9904564
606825183,Centre De Dialyse Et Des Maladies Renales SAADA,clinic,Rue Limoune,,34.0228991,-5.0058145
607107945,الكوثر,hospital,,fez,34.0143665,-4.9998494
789181172,Hopital Ibn Alkhatib,hospital,,Fès,34.0636488,-4.9901604
789182504,مستشفى الغساني,hospital,طريق مستشفى الغساني,فاس,34.0446665,-4.985025
789284217,Centre de santé adarissa المركز الصحي الادارسة,hospital,,,34.0173921,-5.0136059
789787636,dispenssaire ain zliten,hospital,,Fes Médina ain zleten,34.0641064,-4.9809569
789787792,croissant rouge el batha الهلال الاحمر,hospital,,Fes Médina batha,34.0597948,-4.9821199
789788356,docteur Générale,hospital,,Fes Médina batha,34.0602977,-4.9816195
863358238,,hospital,,,34.0530199,-4.9882772
919406293,Hopital Ibn Khaldoun,hospital,,,34.06329,-4.9907796
919586648,,hospital,,,34.0451081,-4.9852771
1008795060,Clinique des Specialites Ryad,clinic,,2 RUE BENZAKOUR ATLAS FES,34.0312267,-4.9988263
