@id,name,amenity,`addr:street`,addr:city,`@lat`,`@lon`
1866502248,Pharmacie Centrale الصيدلية المركزية,pharmacy,Boulevard Mohamed V,Fès,34.036761,-4.9978456
2328748922,Pharmacie Filali صيدلية فيلالي,pharmacy,AV Obaida ibn El Jarrah,Fès,34.0400364,-5.0057261
2328748925,Clinique Al karaouiyine,clinic,,rue imam ali fes nouvelle,34.0397083,-5.0046747
3718016810,Pharmacie Rcif صيدلية الرصيف,pharmacy,,Fès,34.0607842,-4.9730652
3899915428,Centre hospitalier universitaire Hassan II,hospital,,,34.0036766,-4.9637961
4606353707,Pharmacie Irchad صيدلية إرشاد,pharmacy,HAY AL WIFAQ RTE AIN SMAEN,Fès,34.0091704,-5.0299565
4681620692,Pharmacie Basmati صيدلية بسمتي,pharmacy,,Fès,34.0165709,-5.0335195
4698968089,Pharmacie Lablida صيدلية البليدة,pharmacy,شوارة,Fès ⴼⴰⵙ فاس,34.0665469,-4.9713274
4711448391,Pharmacie la Tulipe صيدلية لاتوليب,pharmacy,طريق عين السمن Route Aïn Smenقامة بسم الله طريق عين السمن,Fès,34.0155439,-5.0204776
4711868990,Pharmacie de la Liberté صيدلية الحرية,pharmacy,Place de la Résistance,Fès,34.0452085,-4.9969331
4711934790,Pharmacie les Palmiers صيدلية النخيل,pharmacy,Avenue Hassan II,Fés,34.0394593,-5.0015078
4711934894,Pharmacie de France صيدلية فرنسا,pharmacy,Avenue Hassan II,Fès,34.0429619,-4.9987649
4712385991,Pharmacie l'Amitié صيدلية الصداقة,pharmacy,RUE MED FASSI 221 HAY ADARISSA,Fés,34.014454,-5.0096513
4712445890,Pharmacie Bouslikhane صيدلية بوسليخن,pharmacy,LOT AL WIFAK AIN SMEN,Fés,34.0094085,-5.0261096
4712508653,Pharmacie Acima صيدلية أسيما,pharmacy,CENTRE COMMERCIAL ACIMA,Fès,34.0296079,-5.0105717
4724813489,Pharmacie Echadli صيدلية الشادلي,pharmacy,lotiss anbra S3 45fin rte ain smen fes,Fès,34.0078033,-5.0322131
4725748199,Pharmacie Allal Ben Abdellah صيدلية علال بن عبد الله,pharmacy,Avenue Allal Ben Abdallah,Fès,34.033564,-5.0069404
4729539594,Pharmacie du Maroc صيدلية المغرب,pharmacy,BATHA,Fès,34.0604344,-4.9817913
4730950544,Pharmacie la Criée صيدلية المزاد,pharmacy,11 QUARTIER AL AMANE BENSOUDA,Fès,34.0005071,-5.0434417
4738031421,Pharmacie Bahja صيدلية البهجة,pharmacy,Boulevard Mohammed 5,Fès,34.0389152,-4.9986734
4738681626,Pharmacie de la Santé صيدلية الصحة,pharmacy,Avenue Ismailia,Fès,34.0128456,-4.9854532
4740427422,Pharmacie Idrissi صيدلية الإدريسي,pharmacy,DEBUT HAY SAADA RTE AIN CHKEF,Fès,34.0267254,-5.0034341
4741642523,Pharmacie Debbagh صيدلية الدباغ,pharmacy,Avenue OUBEIDA IBN JARRAH,Fès,34.0428163,-5.0038728
4744887621,Pharmacie et Laboratoire Al Amrani صيدلية و مختبر العمراني,pharmacy,Avenue Lalla Meryem شارع للا مريم,Fès,34.0421156,-5.001262
4746773124,Pharmacie Moulay El Kamel صيدلية مولاي الكامل,pharmacy,Avenue du Prince Heritier champs de course,Fès,34.0365542,-5.0084996
4746889021,Pharmacie Mimousa صيدلية ميموزة,pharmacy,20 AV . Prince Heritier,Fès فاس,34.0326314,-5.0123203
4753542728,Pharmacie Zemmouri صيدلية الزموري,pharmacy,RESIDENCE NAKHLA RTE AIN SMEN,Fès,34.0185021,-5.0190467
4757649122,Centre Belge de rééducation et readaptation,clinic,Avenue Egypte,,34.0446041,-5.0028179
4757773462,Pharmacie et Laboratoire El Karaouyine صيدلية و مختبر القرويين,pharmacy,Bourmana derb kristiani,Fès,34.0210364,-4.9929013
4759451623,Pharmacie Jnane Fès صيدلية جنان فاس,pharmacy,rue Akhtal ibn battouta,Fés,34.0304772,-5.0051309
4759495424,Pharmacie Oudghiri صيدلية الودغيري,pharmacy,Rue Al Baroudi,Fès,34.030867,-5.0078186
4763995654,Pharmacie Assalama صيدلية السلامة,pharmacy,Rue Jordani,Fès,34.0451989,-5.0029903
4772565121,Pharmacie Route d'Immouzer صيدلية طريق إيموزار,pharmacy,Avenue Roi Houssaine,Fès,34.0196299,-4.9959536
4774537683,Pharmacie de l'Hôpital صيدلية المستشفى,pharmacy,Rue Mohammed Diouri زنقة محمد الديوري,Fès,34.0392486,-4.9936096
4774547551,Clinique Slaiki,clinic,9 rue abdelaziz benchekroun fes,,34.0390525,-4.9937218
4778565322,Clinique de fez,clinic,Rue Abdesslam Serghini,rue abdessalam serghini,34.0432026,-4.9965422
4788557121,Pharmacie Moulay Driss صيدلية مولاي ادريس,pharmacy,lot kenza chapm course,Fès,34.0336413,-5.0189835
4788557323,Pharmacie le Palais صيدلية القصر,pharmacy,HAY TARIK A COTE PALAIS SANABIL,Fès,34.0307431,-5.0229027
4797223421,Pharmacie Nouzha صيدلية النزهة,pharmacy,Route Ain Chkef,Fés,34.0117154,-5.0108792
4801102022,Pharmacie El Fath صيدلية الفتح,pharmacy,Avenue Mohamed Es Slaoui,Fès,34.0374402,-5.0003795
4801209322,Pharmacie la Croix Verte صيدلية لاكروا فيرت,pharmacy,Boulevard Mohammed V شارع محمد الخامس,BV MOHAMED 5,34.0385288,-4.9981613
4802070122,Pharmacie Marjane صيدلية مرجان,pharmacy,SUPER MARCHE MARJANE,Fès,34.0492382,-5.0355052
4803244621,Pharmacie Al Ichrak صيدلية الإشراق,pharmacy,367 AHMED BALAFEJ ADARISSA,Fès,34.0167606,-5.0109578
4803711989,Pharmacie Al Mernissi صيدلية المرنيسي,pharmacy,Champs de Cours Dokkarat,Fès,34.0392401,-5.0129692
4805354921,Pharmacie Masjid Ataqwa صيدلية مسجد التقوى,pharmacy,RUE AL AMIR RTE AYN CHKEF,Fès,34.0194622,-5.0056751
4805418523,Pharmacie Sounni صيدلية السني,pharmacy,ERAC HAY AL ADARISSA,Fès,34.0182594,-5.0079836
4805680322,Pharmacie Bennani صيدلية بناني,pharmacy,HAY TARIK I,Fès,34.032488,-5.02417
4807116122,Pharmacie Arrachad صيدلية الرشاد,pharmacy,Hay Griyou Zouagha Haute,Fès,34.0156004,-5.026931
4807118621,Pharmacie Farah صيدلية فرح,pharmacy,Avenue Ibn Al Atir شارع ابن الأثير,Fès,34.0221038,-5.0122016
4807118622,Pharmacie Belbacha صيدلية بالباشة,pharmacy,,Fès,34.0304648,-5.013688
4807373024,Pharmacie Moulay Slimane صيدلية مولاي سليمان,pharmacy,RUE SAIN LOUIS RTE AIN CHKAEF,Fès,34.029394,-5.0005704
4811706021,Pharmacie la Station صيدلية المحطة,pharmacy,,Fès,34.0094418,-5.0456351
4811862222,Pharmacie Azzahraouayn صيدلية الزهراويين,pharmacy,1 BAB atlas lot N 41 zouagha,Fès,34.0247453,-5.0407415
4814399221,Pharmacie Imam Ali صيدلية الإمام علي,pharmacy,rue Imam Malik,Fès,34.0423848,-5.006424
4815220421,Pharmacie Touzani صيدلية التوزاني,pharmacy,Rue Abdellah Guenoun,Fès,34.029135,-5.0265075
4815250118,Pharmacie Pavlov صيدلية بافلوف,pharmacy,IMM 84 N 3 LOT .DALILA-ADDOHA-ZOUAGHA,Fès,34.0129982,-5.0401436
4815400180,Pharmacie Bab Ftouh صيدلية باب فتوح,pharmacy,BAB FTOUH,Fès,34.0608412,-4.9664226
4815416019,Pharmacie Al Ouafae صيدلية الوفاء,pharmacy,LOT 394 NARJISS LOT OUAFAE RTE SEFROU,Fès,34.0112189,-4.9763526
4815618965,Pharmacie Naima Lahlou صيدلية نعيمة لحلو,pharmacy,,Fès,34.0570103,-4.9905245
4815669288,Pharmacie Ben Debbab صيدلية بن دباب,pharmacy,ROND POINT KARAOUINE BEN DEBBAB,Fès,34.0638765,-4.9943906
4815708754,Pharmacie Lwdaya صيدلية لوداية,pharmacy,,Fès ⴼⴰⵙ فاس,34.0697582,-5.0120009
4815722783,Pharmacie Arrajae صيدلية الرجاء,pharmacy,N 1 RUE MERJA ZOUAGHA,Fès,34.03271,-5.047852
4816625221,Pharmacie Bouzoubaa صيدلية بوزوبع,pharmacy,,Fès,34.0206795,-5.0270395
4817715044,Pharmacie El Malhi صيدلية الملحي,pharmacy,HAY TARIK 1 RUE 3,Fès فاس,34.0356746,-5.0245247
4817730225,Pharmacie El Wardi صيدلية الوردي,pharmacy,hay oued fes,Fès,34.0551533,-5.0329316
4817763683,Pharmacie Al Mawada صيدلية المودة,pharmacy,Boulevard Karaouine,Fés,34.0067267,-5.0165884
4817810561,Pharmacie Sahb El Ward صيدلية سهب الورد,pharmacy,5 sehb el ward hors bab ftouh,Fès,34.0543407,-4.9532305
4817822323,Clinique de l'os et du sport,clinic,Avenue Mohamed es Saoui,,34.0384815,-4.9946723
4817824057,Pharmacie Al Ghassani صيدلية الغساني,pharmacy,DHAR MEHRAZ BAB EL GHOUL,Fès,34.0403695,-4.9898563
4817843397,Pharmacie L'IRIS صيدلية الاغيس,pharmacy,19 RUE BIZERT RTE D'IMMOUZER,fés,34.0213738,-4.9984577
4817921284,Pharmacie Ziat صيدلية الزيات,pharmacy,DREB ZIAT BATHA,Fès,34.0576478,-4.9769857
4817966862,Pharmacie Saiss صيدلية سايس,pharmacy,14 RUE 1 BLOC PAM BENSOUDA,Fès,34.0326792,-4.9969956
4818028572,Pharmacie Nahid صيدلية ناهيد,pharmacy,HAY MSELLAH,Fés,34.0633492,-5.0083871
4822485122,Pharmacie El Attar صيدلية العطار,pharmacy,,Fès,34.0420078,-5.0172347
4822797821,Pharmacie Amine صيدلية أمين,pharmacy,32 TRIK JDIDA RCIF,Fès,34.0584106,-4.972887
4823680821,Pharmacie Arssat Zitoun صيدلية عرصة الزيتون,pharmacy,,Fès,33.9916405,-5.042749
4823696521,Pharmacie Saidi صيدلية سعيدي,pharmacy,178 Olivrie secT 27 Zouagha haut,Fès,33.9942988,-5.0401468
4825502723,Pharmacie Niama صيدلية نعمة,pharmacy,,Fès,33.9977066,-5.0480324
4826191124,Pharmacie El Mouahidine صيدلية الموحدين,pharmacy,Avenue des Almohades شارع الموحدين,Fès,34.0427102,-5.0123896
4830547721,Pharmacie la Bonté صيدلية الطيبة,pharmacy,HAY TARIK 2,Fès,34.0337314,-5.0268101
4830823521,Pharmacie Chifae صيدلية الشفاء,pharmacy,Avenue des Far route de meknes,Fès,34.0404482,-5.0087851
4832498324,Pharmacie des FAR صيدلية الجيش الملكي,pharmacy,Avenue des Forces Armées Royales شارع الجيش الملكي,Fès,34.0407699,-5.0166336
4834354024,Pharmacie Doukkarat صيدلية الدكارات,pharmacy,Avenue des Forces Armées Royales شارع الجيش الملكي,Fès فاس,34.0393502,-5.0217359
4841546126,Pharmacie Route de Meknès صيدلية طريق مكناس,pharmacy,lot karim amrani doukarat,Fès,34.0395245,-5.0272749
4841769221,Pharmacie Tazi صيدلية التازي,pharmacy,RTE MEKNES LOTISS LAHBABI N 11 FES,Fès,34.0397879,-5.0313486
4843629022,Pharmacie Tarik صيدلية طارق,pharmacy,86 HAY TARIK 2 RTE BENSOUDA FES,Fès,34.0281108,-5.0239044
4843833522,Pharmacie Ait Skattou صيدلية ايت سقاطو,pharmacy,AIT SKATTO HAY SAADA,Fès,34.0260824,-5.0012035
4845395322,Pharmacie Benjelloun صيدلية بنجلون,pharmacy,HAY TARIK,Fès,34.0268021,-5.0219356
4854006421,Pharmacie Lalla Soukaina صيدلية للاسكينة,pharmacy,Rue lalla soukaina,Fès,34.0183664,-5.026767
4855335623,Pharmacie la Lavande صيدلية الخزامى,pharmacy,Rue 2 Hay Rajae Tarik 1,Fès,34.0335369,-5.022362
4856522726,Clinique El Hitmi,clinic,Abi Daoud,Fès,34.0420918,-5.0116872
4861633424,Pharmacie du Passage صيدلية المسار,pharmacy,Rue Abdelaziz Boutaleb,Fès,34.0359013,-4.9953162
4869569771,Pharmacie Boutouil صيدلية بوطويل,pharmacy,Fes eljadid,Fès ⴼⴰⵙ فاس,34.0560401,-4.9870892
4869596663,Pharmacie Populaire الصيدلية الشعبية,pharmacy,28 BAB JIAF FES JDID,Fès ⴼⴰⵙ فاس,34.0539632,-4.9893255
4869602270,Pharmacie Louajriyeine صيدلية الوجريين,pharmacy,33 DERB JAMAA NOUVEL MELLAH,Fès ⴼⴰⵙ فاس,34.0522071,-4.9901683
4869763221,Clinique Dr Boudali,clinic,Rue Omar Al Idrissi,,34.0378938,-4.9939771
4869893021,Clinique Ben Moussa,clinic,Rue Omar Al Idrissi,87 RUE OMAR EL DRISSI,34.0386401,-4.9934857
4871949522,Pharmacie Ravin صيدلية الرافان,pharmacy,Rue Omar Al Idrissi,Fès,34.0345554,-4.9938759
4871952121,Pharmacie Adarissa صيدلية أدارسة,pharmacy,HAY SAADA RTE AIN CHQEF,Fès,34.0215149,-5.0070833
4883661122,Pharmacie Yassine صيدلية ياسين,pharmacy,Av Saint Louis RTE AIN CHKEF,Fès,34.0158487,-5.0070187
4885602324,Pharmacie Dhar El Mehraz صيدلية ظهر المهراز,pharmacy,,Fès,34.0369664,-4.9896306
4887681622,Pharmacie Jnane El Berdai صيدلية جنان البردعي,pharmacy,,Fès ⴼⴰⵙ فاس,34.0349848,-5.0558381
4894589424,Pharmacie de la Gare صيدلية المحطة,pharmacy,Imam chafai,Fès,34.0448431,-5.0066483
4894951222,Pharmacie Hay El Anbra صيدلية حي العنبرة,pharmacy,38 AV IBN LKHATIB DERB EL WARD FES,Fès,34.0100955,-5.0352723
4894951223,Pharmacie Saadi صيدلية السعدي,pharmacy,715 LOTT ALKARAOUINE AIN CHEKEF,Fès,34.0047517,-5.0137715
4894953823,Pharmacie Ain Amir صيدلية عين عمير,pharmacy,37 rue el flaha hay hassani rte ain chekaf,Fès,34.0026816,-5.004085
4897372624,Pharmacie Boulevard du Joulane صيدلية شارع الجولان,pharmacy,Rue M'diq,Fès,34.0314245,-4.9925868
4902417424,Pharmacie Ville Nouvelle صيدلية المدينة الجديدة,pharmacy,Avenue des Forces Armées Royales شارع الجيش الملكي,Fès,34.0343137,-4.9980042
4904980522,Pharmacie du Boulevard صيدلية الشارع,pharmacy,Avenue Abdallah Chefchaouni,Fès,34.0408528,-4.9966699
4913789721,Pharmacie Mariam صيدلية مريم,pharmacy,,Fès,33.9940124,-5.0477063
4916834521,Pharmacie Oum Al Banine صيدلية أم البنين,pharmacy,Boulevard Ahmed Mekouar,Fès,34.0586789,-4.9795617
4924422021,Pharmacie Sebti صيدلية السبتي,pharmacy,rue Benzakour Pres Clinique ryad,Fès,34.0323548,-5.0002925
4941858121,Pharmacie la Commune صيدلية الجماعة الجديدة,pharmacy,,Fès ⴼⴰⵙ فاس,34.0333816,-5.0153706
4952409023,Pharmacie Youssra صيدلية يسرى,pharmacy,801 bd ibn el haytem q sidi brahim,Fès,34.0293711,-4.9818124
4956435822,Pharmacie Ilyas صيدلية إلياس,pharmacy,LOTSS BAB Lghoul dhar Lmahraz A5 FES,Fès,34.0451274,-4.9876615
4956483023,Pharmacie Bab Alghoul صيدلية باب الغول,pharmacy,Avenue Mohamed Ben Arbi Alaoui شارع محمد السلاوي,Fès,34.0413437,-4.986712
4965854542,Pharmacie Marhaba صيدلية مرحبا,pharmacy,HAY NAJAH SIDI BRAHIM RUE 2 N 98,Fès,34.0269793,-4.9880236
4968139622,Pharmacie Bahia صيدلية باهية,pharmacy,Av MIDELT SIDI BRAHIM,Fès,34.0248246,-4.9854877
4970125221,Pharmacie Boughafer صيدلية بوغافر,pharmacy,29 Rue Boughafer Narjis A,Fès,34.0222771,-4.9859761
4970428922,Pharmacie Al Farabi صيدلية الفرابي,pharmacy,,Fès فاس,34.0369228,-5.0206543
4971325222,Pharmacie Zakaria صيدلية زكرياء,pharmacy,Avenue Ibn Al Atir,Fès,34.0248226,-5.0180415
4973828925,Pharmacie Chaymae صيدلية شيماء,pharmacy,,Fès ⴼⴰⵙ فاس,34.0324461,-5.0585174
4974972222,Pharmacie Ibn Haitam صيدلية بن الهيثم,pharmacy,104 BV KAIRAOUANE NARJISS FES,Fès,34.0211705,-4.9830509
4996666434,Pharmacie El Azhar صيدلية الأزهر,pharmacy,Haj Mustapha Lahlou Adarissa 2,Fès,34.0191682,-5.0126464
5007363922,Pharmacie Ibn Al Hassan صيدلية ابن الحسن,pharmacy,,Fès ⴼⴰⵙ فاس,34.0605169,-5.0049131
5020266326,Pharmacie Iraqi Karima صيدلية عراقي كريمة,pharmacy,Avenue Lissan-Edine Ibn Al-Khatib شارع لسان الدين ابن الخطيب,Fès,34.0206327,-5.0025925
5022123421,Pharmacie Al Ambra  صيدلية العنبرة,pharmacy,Avenue Lissan-Edine Ibn Al-Khatib شارع لسان الدين ابن الخطيب,Fès,34.0227833,-4.9995074
5025460621,Pharmacie Al Irfane صيدلية العرفان,pharmacy,Avenue Lissan-Edine Ibn Al-Khatib شارع لسان الدين ابن الخطيب,Fès,34.0175081,-5.0048856
5039588521,Pharmacie Amal Achifae صيدلية أمل الشفاء,pharmacy,,Fès,34.0303207,-5.0546196
5043818724,Pharmacie Badr صيدلية بدر,pharmacy,CITé Adarissa ang route Ain smen,Fès,34.0215987,-5.0167602
5043819141,Pharmacie Azzahrae صيدلية الزهراء,pharmacy,Mohammed 6 Hay Lala soukaina fes,Fès,34.0202531,-5.0235395
5043839331,Pharmacie Agdal صيدلية أكدال,pharmacy,Route Ain Smen Hay Badr,Fès,34.0214796,-5.0205636
5045436328,Clinique Almajd,clinic,Mohammed El Fassi Hay Adarissa,Fés,34.0171995,-5.0169317
5054002323,Centre Hémodialyse Moulay Driss,clinic,Rue Ibn Darraj,,34.0257104,-5.0242824
5054002331,Pharmacie Labaraka صيدلية البركة,pharmacy,Omar Ibn Abdeljalil Hay Adarissa,Fès,34.0189521,-5.0152133
5054019822,Pharmacie Ennassiri صيدلية الناصري,pharmacy,Route Ain Smen Hay Badr,Fès,34.0233883,-5.0210753
5055972121,Pharmacie Omari صيدلية عماري,pharmacy,HAY SAADA,Fès,34.0268791,-5.0063514
5081200223,Pharmacie Demnati صيدلية الدمناتي,pharmacy,9 HAY GRIOU ZOUAGHA,Fès,34.0207935,-5.0303522
5084491622,Pharmacie Platanes صيدلية السيجان,pharmacy,,Fès,34.0043523,-5.00755
5085452623,Pharmacie de l'Atlas صيدلية الأطلس,pharmacy,,Fès,34.0318989,-4.9948294
5100489621,Pharmacie Afifa صيدلية عفيفة,pharmacy,HAY SAADA RESIDENCE NOUR,Fès,34.0234473,-5.0091718
5107085722,Pharmacie Ifrane صيدلية إفران,pharmacy,Lot QODS route Immouzer,Fès,34.0144858,-5.0015964
5117313022,Pharmacie Al Korachi صيدلية القرشي,pharmacy,,Fès,34.0191247,-5.0016602
5119394922,Pharmacie Jabri صيدلية جابري,pharmacy,,Fès,34.0158774,-5.0043792
5128231924,Pharmacie L'Opera صيدلية الأوبرا,pharmacy,LOT 94 MAGAZINE AIT SKATTO,Fès,34.0288781,-4.9951509
5130402124,Pharmacie Erriad صيدلية الرياض,pharmacy,,Fès,34.0244919,-5.0126568
5130442846,Pharmacie Mekouar صيدلية مكوار,pharmacy,Avenue Roi Houssaine Route d ' Immouzzer Resi Riad,Fès,34.0309569,-4.9981453
5132771421,Clinique Les Jumelles,clinic,Avenue Roi Houssaine Rue Ibn Hani Face al Omrane,,34.030257,-4.9985712
5142826921,Pharmacie Pasteur صيدلية باستور,pharmacy,HAY SALAM BOURKAYEZ,Fès,34.0271122,-5.009844
5147046921,Clinique Saada,clinic,Hay Zaza,,34.0254959,-5.0041032
5147303621,Pharmacie Arrazi صيدلية الرازي,pharmacy,Boulevard Moulay Hicham,Fès,34.0260606,-4.9976251
5158675622,clique assalam,clinic,Ait Skatou,ait skatou,34.0260471,-4.9994625
5173841426,Pharmacie Conseil صيدلية النصيحة,pharmacy,Route de Sefrou Lotis Ouafae 1,Fès,34.0132374,-4.9815705
5183381724,Pharmacie Al Ihssane,pharmacy,6 LOTISS EL WAFA BD MY RACHID RTE SEFROU FEZ,Fès,34.0101598,-4.9792405
5184257351,Pharmacie El Karam صيدلية الكرم,pharmacy,DHAR LKHMISS L'HABITAT,Fés,34.0698093,-4.9870605
5185720525,Pharmacie Blanco صيدلية بلانكو,pharmacy,Ridicule Yasmine rte Ain chqef,Fès,33.9992559,-5.0091302
5185876621,Pharmacie El Majd صيدلية المجد,pharmacy,Avenue Karouyine شارع القرويين,Fès,34.0177335,-4.980803
5188283423,Pharmacie Al Ahbab صيدلية الأحباب,pharmacy,254 Lot fadela 3 rte Ain chkef,Fès,33.9992501,-5.004313
5190415822,Pharmacie Taiba صيدلية طيبة,pharmacy,Route Ain Chkef,Fès,34.001416,-5.0066556
5190427838,Pharmacie Ibn Khaldoun صيدلية ابن خلدون,pharmacy,Avenue Karouyine شارع القرويين,Fés,34.0144522,-4.9717966
5194917728,Pharmacie C.H.U Hassan II صيدلية الحسن الثاني,pharmacy,Avenue My Rachid Route de Sefrou Zohor 2 Lotis Laila,Fès,34.0076473,-4.9779753
5201978023,Pharmacie Al Inaya صيدلية العناية,pharmacy,Avenue Karouyine شارع القرويين,Fès,34.0166064,-4.9775556
5203942033,Pharmacie Al Ikhwa صيدلية الإخوة,pharmacy,Route Ain Chkef,Fès,34.0069752,-5.0085257
5203986721,Pharmacie Haoudi صيدلية هاودي,pharmacy,Avenue Karouyine شارع القرويين,Fès,34.0196338,-4.9851537
5204002337,Pharmacie Najmi صيدلية نجمي,pharmacy,Hay anas rte ain chkef,Fès,34.0067506,-5.0053672
5204049521,Pharmacie La Victoire صيدلية النصر,pharmacy,Avenue Abi Horaira Zohor 1,Fès,34.0178887,-4.9862395
5206234024,Pharmacie Fatima Ezzahra صيدلية فاطمة الزهراء,pharmacy,2 LOT TOURIA ANAS 3,Fès,34.0046872,-5.0014405
5207338425,Pharmacie El Houda صيدلية الهدى,pharmacy,Avenue Abi Horaira Zohor 1,Fès,34.0171254,-4.9894159
5216068021,Pharmacie Bakkali صيدلية البقالي,pharmacy,Route Ain Chkef,Fès,34.0103035,-5.0057817
5217881721,Pharmacie Florida صيدلية فلوريدا,pharmacy,Hay Anass 3,Fès,34.0076467,-5.0031474
5217885522,Pharmacie Mont Fleuri صيدلية الجبل,pharmacy,Avenue Karama Zohour 1,Fès,34.0152601,-4.9860772
5219627522,Pharmacie Al Yousr صيدلية اليسر,pharmacy,Complexe Salalam rte immouzer,Fès,34.012366,-5.0027424
5231444736,Pharmacie Al Fadila صيدلية الفضيلة,pharmacy,Avenue Karama Zohour 1,Fès,34.0114188,-4.988769
5239191223,Pharmacie Ryad صيدلية الرياض,pharmacy,Avenue Ibn Khatteb acces bouremana,Fès,34.0265672,-4.9935021
5239191257,Pharmacie Ghizlane صيدلية غزلان,pharmacy,RTE DE SEFROULOTISS OUAFAE N 342 FES,Fés,34.0057403,-4.9687656
5239191525,Pharmacie l'Entente صيدلية الإتفاق,pharmacy,160 LOTTI ERAC HAY WIFAK RTE AIN SMEN,Fès,34.0242974,-4.9897763
5239191530,Pharmacie Route de Sefrou صيدلية طريق صفرو,pharmacy,Boulevard Moulay Rachid,Fès,34.0212182,-4.9879182
5239335924,Pharmacie Faculté de Médecine صيدلية كلية الطب,pharmacy,hay elamal rte de sefrou,Fès فاس,34.0076423,-4.9652236
5240910822,Pharmacie Fès Shore صيدلية فاس شور,pharmacy,Route du parc Fes-Shore,Fès فاس,34.0093643,-4.9616705
5241087321,Pharmacie Nour El Houda صيدلية نور الهدى,pharmacy,BVD Israe,Fès,34.0129244,-4.965755
5244010021,Pharmacie Champs de Courses صيدلية ملعب الخيل,pharmacy,champs de Cours,Fès فاس,34.036918,-5.0152573
5244887442,Pharmacie Firdaous صيدلية الفردوس,pharmacy,Avenue Al Manama Zohour 1,Fès,34.0146357,-4.9897963
5250338721,Pharmacie de l'Hôpital Universitaire صيدلية المستشفى الجامعي,pharmacy,Al Madina Mounawara,Fès ⴼⴰⵙ فاس,34.0106557,-4.9657329
5251848522,Pharmacie Ibn Hazm صيدلية بن حزم,pharmacy,,Fès,34.0091231,-4.9695833
5260991734,Pharmacie Yasmine صيدلية ياسمين,pharmacy,BVD D'oran mont fleuri 2,Fès,34.0102284,-4.9880887
5263513421,Pharmacie Ben Cheikh صيدلية ابن الشيخ,pharmacy,,Fés,34.0127576,-4.9700355
5263754721,Pharmacie Al Wassila صيدلية الوسيلة,pharmacy,200 ROUTE DE SEFROU LOTTI WAFAE FEZ,Fès,34.0063267,-4.9737192
5269865621,Pharmacie Al Fajr صيدلية الفجر,pharmacy,Av Ocean Pacifique Hay Riad,Fès ⴼⴰⵙ فاس,34.0154938,-4.9630375
5270743531,Pharmacie Beyrout صيدلية بيروت,pharmacy,139 av bayrout mont fleuri 1,Fès,34.0078871,-4.984039
5270743624,Pharmacie Lahbabi صيدلية لحبابي,pharmacy,BV BAYROUT Résidence Rawd Azhar Mont fleuri,Fès,34.0044736,-4.9892319
5281877223,Pharmacie le Docteur صيدلية الدكتور,pharmacy,Av Anawal Narjis D,Fès ⴼⴰⵙ فاس,34.018087,-4.9665089
5283794728,Pharmacie Mourchid صيدلية مرشد,pharmacy,bvd Attadhia Narjiss,Fès,34.0133949,-4.9784725
5291622524,Pharmacie Complexe Sportif صيدلية المركب الرياضي,pharmacy,Av Rahma Narjis,Fès ⴼⴰⵙ فاس,34.0171017,-4.9699202
5293570222,Pharmacie Lina صيدلية لينة,pharmacy,Avenue Al Majd,Fès,34.0166758,-4.9745419
5295524721,Pharmacie Azzouzi صيدلية عزوزي,pharmacy,Avenue Al Wahda,Fès,34.0153241,-4.9795386
5298347522,Pharmacie Yousfi صيدلية يوسفي,pharmacy,LOT LAZRAK MONT FLEURI 2,Fès,34.0057858,-4.9834357
5303210932,Pharmacie Sidi Brahim صيدلية سيدي ابراهيم,pharmacy,HAY EL QODS 2 BLOC 13 ERAC SIDI BRAHIM FES,Fès,34.0201153,-4.9703139
5303267325,Pharmacie Noureddine صيدلية نور الدين,pharmacy,Awint Al Hajaj Bloc A4,Fès ⴼⴰⵙ فاس,34.0200563,-4.9641712
5304746323,Pharmacie du Quartier Industriel صيدلية الحي الصناعي,pharmacy,HAY SIDI BRAHIM BLOC 18 N 6 ERAC FES,Fès ⴼⴰⵙ فاس,34.0222491,-4.9714568
5308231623,Pharmacie Talbi صيدلية طالبي,pharmacy,Avenue Errahma,Fès ⴼⴰⵙ فاس,34.0193429,-4.9765996
5309147427,Pharmacie Al Ikhlasse صيدلية الإخلاص,pharmacy,Avenue Koufa Zohour 2,Fès,34.0041222,-4.978387
5309148523,Pharmacie Zohour صيدلية الزهور,pharmacy,Zohour 2,Fès,34.0044491,-4.9828381
5309148722,Pharmacie Al Akhawayn صيدلية الأخوين,pharmacy,Avenue Ismailia Mont fleuri2,Fès,34.0074565,-4.9804051
5316237421,Pharmacie Hay El Hassani صيدلية حي الحساني,pharmacy,HAY EI HASSANI BLOC 4 ERAC SIDI BRAHIM,Fès ⴼⴰⵙ فاس,34.0209771,-4.9744947
5316386524,Pharmacie Narjiss صيدلية النرجس,pharmacy,,Fès,34.0206094,-4.9788651
5316862623,Pharmacie Ismailia صيدلية الإسماعيلية,pharmacy,Avenue Ismailia Lotis Lahlou Zohour 1,Fès,34.0109079,-4.9831621
5320229021,Pharmacie Cotef صيدلية كوطيف,pharmacy,,Fès,34.0227418,-4.9779877
5320984826,Pharmacie Saoussane صيدلية سوسن,pharmacy,Avenue Benzert,Fès,34.002518,-4.9877202
5320984833,Pharmacie La Famille صيدلية العائلة,pharmacy,Avenue Chenguit Zohour 2,Fès,34.0050682,-4.9869764
5333830028,Clinique de La Vision de Fes,clinic,Avenue My Abdellah Route d ' Imouzzer Fès Saiss Lotis Riad Annakhil,,33.9935097,-4.991849
5333830031,Pharmacie Hameda Benchekroun صيدلية حميدة بنشقرون,pharmacy,llah Route d ' Imouzzer Rue Bab Mansour,Fès,34.0086636,-4.993274
5333830122,Polyclinique Annakhil,clinic,Avenue My Abdellah Route d ' Imouzzer Fès Saiss,,33.9950093,-4.9934955
5333830421,Pharmacie La Suite صيدلية لاسويط,pharmacy,85lotiss Riad Nakhil route Immouzzer Fes,Fès,33.9939304,-4.9905295
5356941721,Pharmacie Makro صيدلية ماكرو,pharmacy,3 lotti N 15 cartier bensouda,Fès,34.0201123,-5.0532944
5358636223,La Grande Pharmacie الصيدلية الكبرى,pharmacy,BENSOUDA EN FACE DE ATACADAO,Fès,34.0239277,-5.0555968
5360680621,Pharmacie El Boutahri صيدلي البوطهري,pharmacy,lotti hawae jamil Masjid 1 rte ras l ma,Fès,34.0182077,-5.0574499
